{
  "claim_id": "refusal-002",
  "claim_type": "refusal",
  "claim": {
    "text": "The system refused a downstream mutation before binding.",
    "limits": [
      "Applies only to mutation-event-2025-05-02-007",
      "Does not claim system-wide refusal behaviour"
    ]
  },
  "object": {
    "id": "mutation-event-2025-05-02-007",
    "description": "Downstream mutation request at pre-binding stage on 2025-05-02."
  },
  "authority": {
    "type": "policy",
    "reference": "ALVIANTECH-POLICY-v1.1-section-3"
  },
  "conditions": [
    {
      "id": "condition-01",
      "description": "Mutation request was received before binding.",
      "result": "confirmed"
    }
  ],
  "evidence": [
    {
      "id": "evidence-01",
      "type": "log",
      "reference": "system-log-2025-05-02T14:10:00Z",
      "supports_claim": true
    }
  ],
  "receipt": {
    "present": true,
    "type": "refusal_receipt",
    "reference": "receipt-2025-05-02-007",
    "timestamp": "2025-05-02T14:10:01Z"
  },
  "replay": {
    "present": false,
    "notes": "Replay fixture not yet created."
  },
  "downstream_effect": {
    "status": "blocked",
    "description": "No downstream mutation occurred."
  }
}
