{
  "claim_id": "refusal-001",
  "claim_type": "refusal",
  "claim": {
    "text": "The system refused a downstream mutation before binding, and this refusal was recorded.",
    "limits": [
      "Applies only to this specific mutation event on 2025-05-01",
      "Does not claim system-wide refusal behaviour",
      "Does not claim EU compliance"
    ]
  },
  "object": {
    "id": "mutation-event-2025-05-01-001",
    "description": "A downstream mutation request rejected by the HOLD gate at pre-binding stage."
  },
  "authority": {
    "type": "policy",
    "reference": "ALVIANTECH-POLICY-v1.1-section-3"
  },
  "conditions": [
    {
      "id": "condition-01",
      "description": "Mutation request was received before binding.",
      "result": "confirmed"
    },
    {
      "id": "condition-02",
      "description": "HOLD gate was active at time of request.",
      "result": "confirmed"
    }
  ],
  "evidence": [
    {
      "id": "evidence-01",
      "type": "log",
      "reference": "system-log-2025-05-01T10:22:00Z",
      "supports_claim": true
    },
    {
      "id": "evidence-02",
      "type": "policy_evaluation_trace",
      "reference": "eval-trace-2025-05-01-001",
      "supports_claim": true
    }
  ],
  "receipt": {
    "present": true,
    "type": "refusal_receipt",
    "reference": "receipt-2025-05-01-001",
    "timestamp": "2025-05-01T10:22:01Z"
  },
  "replay": {
    "present": true,
    "fixture": "tests/fixtures/refusal-001-replay.json",
    "notes": "Replay fixture reproduces the pre-binding HOLD condition."
  },
  "downstream_effect": {
    "status": "blocked",
    "description": "No downstream mutation occurred. Path confirmed closed."
  }
}
